{
  "digest": "tile-demand-digest/1",
  "service": "buildings",
  "tileset": "overture-global",
  "kind": "tileset",
  "qk8": "-",
  "window": "2026-08-23/P1D",
  "req": 9120,
  "miss": 4,
  "p50_gen_ms": 0,
  "avg_bytes": 18220,
  "tiles_observed": 1,
  "top_id": [
    ["tileset.json", 9120]
  ]
}
